id,title,description,link,image_link,additional_image_link,availability,price,price_x,sale_price,sale_price_effective_date,google_product_category,product_type,brand,mpn,condition,age_group,color,gender,material,pattern,size,item_group_id,promotion_id,custom_label_0,custom_label_1,custom_label_2,custom_label_3,custom_label_4,shipping,shipping_label,shipping_weight,shippg_length,shippg_width,shippg_height,is_bundle,multipack,minimum_price
16179,Black River Iron Wall Sconce Left,"The Black River wall sconce is available with hand forged tendrils flowing freely to the right or to the left. Pictured above in Natural Black, it is a versatile piece that wears any finish well, although special finishes especially highlight the hammered textures in the iron. Choose from five different globe options: frosted glass, parchment, kraft, and ivory are glass and offer some translucency. Our hand fired copper is opaque, and creates a wonderful indirect lighting effect above the sconce. The image above shows a Natural Black finish, which creates the iron's original look. The globe pictured is Frosted Glass.Dimensions:  18""W x 5""D x 11""H",https://urbanforge.com/black-river-iron-wall-sconce-left/?sku=901-565Base,https://cdn11.bigcommerce.com/s-p6f4il8ut9/products/13704/images/20568/901-565-FRO_Rush_Wall_Sconce_Left__35893__24478.1531087121.1280.1280.jpg?c=2,,in stock,184.00 USD,184,,,Home & Garden > Lighting > Lamps,Lighting > Sconces,Urban Forge,901-565Base,new,,,,,,,,,,,,,,,,12,,,,No,,USD
16180,Black River Iron Wall Sconce Right,"The Black River wall sconce is available with hand forged tendrils flowing freely to the right or to the left. Pictured above in Natural Black, it is a versatile piece that wears any finish well, although special finishes especially highlight the hammered textures in the iron. Choose from five different globe options: frosted glass, parchment, kraft, and ivory are glass and offer some translucency. Our hand fired copper is opaque, and creates a wonderful indirect lighting effect above the sconce.The image above shows a Natural Black finish, which creates the iron's original look. The globe pictured is Frosted Glass. Dimensions:  18""W x 5""D x 11""H",https://urbanforge.com/black-river-iron-wall-sconce-right/?sku=901-548Base,https://cdn11.bigcommerce.com/s-p6f4il8ut9/products/13705/images/20569/901-548_Rush_Wall_Sconce_Right__22674__55262.1531087121.1280.1280.jpg?c=2,,in stock,184.00 USD,184,,,Home & Garden > Lighting > Lamps,Lighting > Sconces,Urban Forge,901-548Base,new,,,,,,,,,,,,,,,,12,,,,No,,USD
16337,Greenwood Stool,"Our Greenwood Barstool is such a unique wrought iron design. Hand textured, organic lines, swivel seat -- these wrought iron counter stools achieve both beauty and comfort. These high end swivel bar stools are available with 25"" or 30"" base heights to accommodate traditional counters or bars. If more leg space is needed, custom heights are available. Adding the compressed seat thickness (1"" to 2"") to the base height will determine the approximate seat height. Allow 7""-10"" inches of leg-room under the counter or bar. The hand-crafted base is nicely designed, very sturdy, with a foot rest at a comfortable height. These wrought iron counter stools include easy glider inserts to protect your floors.Seating options include wood, our standard 1"" padded seat, or a premium 2"" seat with any wood or upholstery option in our line. If you prefer to customize the upholstery yourself, you may order the white cloth cushion which comes ready to cover or serve as-is. We would also be happy to custom-make the seat with your own fabric; contact customer service for details. ",https://urbanforge.com/shop-new-stuff/woodland-barstool/?sku=980-330Base,https://cdn11.bigcommerce.com/s-p6f4il8ut9/products/14425/images/21766/Woodland-Stool-1__68778__58974.1531087389.1280.1280.jpg?c=2,,in stock,698.00 USD,698,,,Furniture > Chairs,New > Seating,Urban Forge,980-330Base,new,,,,,,,,,,,,,,,,,1,1,1,No,,USD
,,,,,,,,,,,,,,,,,,,,,,,,,,,,,,,,,,,,,
15999,Fair Oak Wrought Iron Bed,"The Fair Oak bed features swirling vines and hand-forged leaves secured with iron wraps.This wonderful example of artisan-craftsmanship is shown in natural black but comes available in other finishes as well.The wraps and leaves are especially stunning in gold or copper accents! The bed may be ordered in a variety of sizes, as a complete set (including headboard, foot board and heavy duty frame), or as a headboard and frame only.Hand-CraftedMade in USAGuaranteed ForeverFree Shipping to the Continental United StatesChoose Your Favorite Hand-Rubbed iron Finishes and AccentsMade from Recycled Iron and Low VOC FinishesHeavy duty frameAvailable in Twin, Full, Queen, King, and California KingInstructions Included for Easy InstallationCustomizable - We Can Change Any Dimension or Detail!DimensionsHeadboard Height:  60""Footboard Height:  42""Frame Height:  9""What are our customers saying about this piece?""Thanks for checking on the bed, I got it Friday afternoon and got it delivered to the customer and assembled. She loved it. Semmes to be very solid and the metal work looks great. I'll recommend you guys in the future."" -Brooks, North Carolina""Thank you so much for all of your help with this order! The Fair Oak bed arrived yesterday and it is beautiful!"" -Eva, Pennsylvania",https://urbanforge.com/fair-oak-wrought-iron-bed/?sku=900-779Base,https://cdn11.bigcommerce.com/s-p6f4il8ut9/products/13391/images/20011/900-767_Eden_Isle_Bed_Full__95011__30706.1531086993.1280.1280.jpg?c=2,in stock,3116.00 USD,,,,Furniture > Beds & Accessories,Furniture > Beds > California King,Urban Forge,,900-779Base,new,,,,,,,,,,,,,,,,193,,,,No,,USD
16003,Marshall Wrought Iron Bed,"Restful, simple patterns in strong vertical posts make our Marshall bed a juxtaposition of strength and quietude.This wonderful example of artisan-craftsmanship is shown in natural black and is available in other finishes as well.It may be ordered in a variety of sizes, as a complete set (including headboard, foot board and heavy duty frame), or as a headboard and frame only.Hand-CraftedMade in USAGuaranteed ForeverFree Shipping to the Continental United StatesChoose Your Favorite Hand-Rubbed iron Finishes and AccentsMade from Recycled Iron and Low VOC FinishesHeavy duty frameAvailable in Twin, Full, Queen, King, and California KingInstructions Included for Easy InstallationCustomizable - We Can Change Any Dimension or Detail!DimensionsHeadboard Height:  60Footboard Height:  26Frame Height:  9"" ",https://urbanforge.com/marshall-wrought-iron-bed/?sku=900-822Base,https://cdn11.bigcommerce.com/s-p6f4il8ut9/products/13412/images/20032/900-819_Mission_Bed_Full__15617__83628.1531087000.1280.1280.jpg?c=2,in stock,2029.00 USD,,,,Furniture > Beds & Accessories,Furniture > Beds > California King,Urban Forge,,900-822Base,new,,,,,,,,,,,,,,,,177,,,,No,,USD
16028,Whispering Springs Wrought Iron Sleigh Bed,"The Whispering Springs Sleigh bed is a lively piece showcasing a unique take on a classic silhouette.This wrought iron sleigh bed is a wonderful example of artisan-craftsmanship and is shown in natural black but may be ordered in any of our other finishes shown above. This queen size iron bed can be purchased as a complete set (including headboard, foot board, and heavy-duty frame), or as a headboard and frame only.Hand-CraftedMade in USAGuaranteed ForeverFree Shipping to the Continental United StatesChoose Your Favorite Hand-Rubbed iron Finishes and AccentsMade from Recycled Iron and Low VOC FinishesHeavy duty frameAvailable in Twin, Full, Queen, King, and California KingInstructions Included for Easy InstallationCustomizable - We Can Change Any Dimension or Detail!DimensionsHeadboard Height:  57""Footboard Height:  33""Frame Height:  9"" ",https://urbanforge.com/whispering-springs-wrought-iron-sleigh-bed/?sku=904-107Base,https://cdn11.bigcommerce.com/s-p6f4il8ut9/products/13472/images/23437/whispering-springs-main-branded__20542.1599682959.1280.1280.jpg?c=2,in stock,2899.00 USD,,,,Furniture > Beds & Accessories,Furniture > Beds > California King,Urban Forge,,904-107Base,new,,,,,,,,,,,,,,,,245,,,,No,,USD
16061,Tuscan Wrought Iron Bed,"Simple lines, clean iron twists, and a modest French influence makes the Tuscan bed an elegant centerpiece for any bedroom.Order it in Natural Black, as pictured, or in any of our finishes shown above. The bed may be ordered as a complete set (including headboard, foot board and heavy duty frame), or as a headboard and frame only. Hand-CraftedMade in USAGuaranteed ForeverFree Shipping to the Continental United StatesChoose Your Favorite Hand-Rubbed iron Finishes and AccentsMade from Recycled Iron and Low VOC FinishesHeavy duty frameAvailable in Twin, Full, Queen, King, and California KingInstructions Included for Easy InstallationCustomizable - We Can Change Any Dimension or Detail!DimensionsHeadboard Height:  60""Footboard Height:  26""Frame Height:  9""What are our customers saying about this piece?""We installed it yesterday. It looks great and we sooo appreciate you getting it to us fast. I look forward to working with you again. Thanks for everything!"" -Terry, designer in Colorado",https://urbanforge.com/tuscan-wrought-iron-bed/?sku=900-856Base,https://cdn11.bigcommerce.com/s-p6f4il8ut9/products/13510/images/20237/900-853_Prescott_Bed_Full__12574__60816.1531087041.1280.1280.jpg?c=2,in stock,1738.00 USD,,,,Furniture > Beds & Accessories,Furniture > Beds > California King,Urban Forge,,900-856Base,new,,,,,,,,,,,,,,,,159,,,,No,,USD
16071,Windfall Wrought Iron Bed,"branches reach and twine across the headboard and footboard of this beautiful example of artisan-craftsmanship.The Windfall bed is shown in Hand Rubbed Bronze but is available in any of our finishes listed above.It may be ordered as a complete set (including headboard, footboard, and heavy duty frame), or as a headboard and frame only.Hand-CraftedMade in USAGuaranteed ForeverFree Shipping to the Continental United StatesChoose Your Favorite Hand-Rubbed iron Finishes and AccentsMade from Recycled Iron and Low VOC FinishesHeavy duty frameAvailable in Twin, Full, Queen, King, and California KingInstructions Included for Easy InstallationCustomizable - We Can Change Any Dimension or Detail!DimensionsHeadboard Height:  60""Footboard Height:  42""Frame Height:  9""What are our customers saying about this piece?""Yes, I just received it. Please tell your shipping manager thank you. The bed is nicer than I expected and looks great in the log home; thanks for all your good communications and service excellence in this transaction."" -Susan, Indiana ",https://urbanforge.com/windfall-wrought-iron-bed/?sku=904-718Base,https://cdn11.bigcommerce.com/s-p6f4il8ut9/products/13528/images/20256/904-714_Norfork_Bed_Full__22468__19836.1531087046.1280.1280.jpg?c=2,in stock,3189.00 USD,,,,Furniture > Beds & Accessories,Furniture > Beds > California King,Urban Forge,,904-718Base,new,,,,,,,,,,,,,,,,200,,,,No,,USD
16094,Rose Bud Wrought Iron Bed,"The Knot collection is an elegant addition to any room with its graceful iron ties and minimalist feel, whether your decor consists of rustic, casual, western, or even contemporary elements. It may be ordered as a complete set (including headboard, foot board and heavy duty frame), or as a headboard and frame only. Although shown in Natural Black, you may specify any finish listed above!Hand-CraftedMade in USAGuaranteed ForeverFree Shipping to the Continental United StatesChoose Your Favorite Hand-Rubbed iron Finishes and AccentsMade from Recycled Iron and Low VOC FinishesHeavy duty frameAvailable in Twin, Full, Queen, King, and California KingInstructions Included for Easy InstallationCustomizable - We Can Change Any Dimension or Detail!DimensionsHeadboard Height:  63""Footboard Height:  42""Frame Height:  9""What are our customers saying? ""Thanks for the follow up. The bed is beautiful. The client is happy with it, so we are as well."" -Roger, designer in Florida",https://urbanforge.com/rose-bud-wrought-iron-bed/?sku=901-075Base,https://cdn11.bigcommerce.com/s-p6f4il8ut9/products/13565/images/20308/901-072_Knot_Bed__42462__42208.1531087060.1280.1280.jpg?c=2,in stock,2029.00 USD,,,,Furniture > Beds & Accessories,Furniture > Beds > California King,Urban Forge,,901-075Base,new,,,,,,,,,,,,,,,,139,,,,No,,USD
16164,Westfork Wrought Iron & Copper Bed,"The Westfork collection features woven strips in simple, stunning designs that feature the swirling color and dappled light of our unique copper patinas. We create our own colored copper here at our Arkansas forge using special mineral recipes and dousing techniques you won't find anywhere else. Each copper piece will be unique and spontaneous, with varying effects.The Westfork is an award winning Urban Forge original and features these hand-fired copper strips woven into the headboard and footboard. Shown in Natural Black iron, it may be specified in any available finish listed above. The Westfork can be ordered as a complete set (including headboard, foot board and heavy duty frame), or as a headboard and frame only.Hand-CraftedMade in USAGuaranteed ForeverFree Shipping to the Continental United StatesChoose Your Favorite Hand-Rubbed iron Finishes and AccentsMade from Recycled Iron and Low VOC FinishesHeavy duty frameAvailable in Twin, Full, Queen, King, and California KingInstructions Included for Easy InstallationCustomizable - We Can Change Any Dimension or Detail!DimensionsHeadboard Height 56""Footboard Height 36""Frame Height 9""",https://urbanforge.com/westfork-wrought-iron-copper-bed/?sku=904-743Base,https://cdn11.bigcommerce.com/s-p6f4il8ut9/products/13677/images/23439/rushton-westfork-bed-main__07990.1599683427.1280.1280.jpg?c=2,in stock,3479.00 USD,,,,Furniture > Beds & Accessories,Furniture > Beds > California King,Urban Forge,,904-743Base,new,,,,,,,,,,,,,,,,185,,,,No,,USD
16181,Sylamore Wrought Iron Bed,"Wood and iron combine in this lively piece from the Sylamore Collection. Wrought iron branches held in place with iron wraps dance across the headboard and footboard, bracketed by beautiful, solid Evergreen wood bedposts.The bed is shown in Natural Black and is available in any of the finishes listed above, although this detailed piece highlights especially well in gold or copper. It may be ordered as a complete set (including headboard, footboard, and heavy duty frame), or as a headboard and frame only.Hand-CraftedMade in USAGuaranteed ForeverFree Shipping to the Continental United StatesChoose Your Favorite Hand-Rubbed iron Finishes and AccentsMade from Recycled Iron and Low VOC FinishesHeavy duty frameAvailable in Twin, Full, Queen, King, and California KingInstructions Included for Easy InstallationCustomizable - We Can Change Any Dimension or Detail!DimensionsHeadboard Height 60""Footboard Height 42""Frame Height 9""",https://urbanforge.com/sylamore-wrought-iron-bed/?sku=900-987Base,https://cdn11.bigcommerce.com/s-p6f4il8ut9/products/13712/images/20580/900-981_Sassafras_Bed_Full__55486__17277.1531087124.1280.1280.jpg?c=2,in stock,2899.00 USD,,,,Furniture > Beds & Accessories,Furniture > Beds > California King,Urban Forge,,900-987Base,new,,,,,,Queen,13712,,,,,,,,,271,,,,No,,USD
16248,Twist Iron Bed,"Our Twist Iron Bed has a sophisticated simplicity that makes a remarkably bold statement. Modern geometric shapes in a bed inspired by iron beds of the past. The signature twist featured in the headboard and footboard and the contrasting iron treatment set this bed apart. Custom made by our artisan blacksmiths in any size, from twin to California King to be just right for your space. The elegant lines, subtle details, and twisted iron make this hand-forged iron bed a unique treasure.  Shown in our sleek Natural Black iron finish, but you can make it yours by choosing from the many finish and accent options available!Hand-CraftedMade in USAGuaranteed ForeverFree Shipping to the Continental United StatesChoose Your Favorite Hand-Rubbed iron Finishes and AccentsMade from Recycled Iron and Low VOC FinishesHeavy duty frameAvailable in Twin, Full, Queen, King, and California KingInstructions Included for Easy InstallationCustomizable - We Can Change Any Dimension or Detail!DimensionsHeadboard Height: 45""Footboard Height: 32""Frame Height 9""  ",https://urbanforge.com/twist-iron-bed/?sku=987-136,https://cdn11.bigcommerce.com/s-p6f4il8ut9/products/14599/images/23432/twist-bed-branded__09088.1599682174.1280.1280.jpg?c=2,in stock,1474.36 USD,,,,Furniture > Beds & Accessories,Furniture > Beds > California King,Urban Forge,,987-136,new,,,,,,Twin,14599,,,,,,,,,235,,,,No,,USD
16249,Twist Iron Bed,"Our Twist Iron Bed has a sophisticated simplicity that makes a remarkably bold statement. Modern geometric shapes in a bed inspired by iron beds of the past. The signature twist featured in the headboard and footboard and the contrasting iron treatment set this bed apart. Custom made by our artisan blacksmiths in any size, from twin to California King to be just right for your space. The elegant lines, subtle details, and twisted iron make this hand-forged iron bed a unique treasure.  Shown in our sleek Natural Black iron finish, but you can make it yours by choosing from the many finish and accent options available!Hand-CraftedMade in USAGuaranteed ForeverFree Shipping to the Continental United StatesChoose Your Favorite Hand-Rubbed iron Finishes and AccentsMade from Recycled Iron and Low VOC FinishesHeavy duty frameAvailable in Twin, Full, Queen, King, and California KingInstructions Included for Easy InstallationCustomizable - We Can Change Any Dimension or Detail!DimensionsHeadboard Height: 45""Footboard Height: 32""Frame Height 9""  ",https://urbanforge.com/twist-iron-bed/?sku=987-137,https://cdn11.bigcommerce.com/s-p6f4il8ut9/products/14599/images/23432/twist-bed-branded__09088.1599682174.1280.1280.jpg?c=2,in stock,1636.18 USD,,,,Furniture > Beds & Accessories,Furniture > Beds > California King,Urban Forge,,987-137,new,,,,,,Full,14599,,,,,,,,,235,,,,No,,USD
16250,Twist Iron Bed,"Our Twist Iron Bed has a sophisticated simplicity that makes a remarkably bold statement. Modern geometric shapes in a bed inspired by iron beds of the past. The signature twist featured in the headboard and footboard and the contrasting iron treatment set this bed apart. Custom made by our artisan blacksmiths in any size, from twin to California King to be just right for your space. The elegant lines, subtle details, and twisted iron make this hand-forged iron bed a unique treasure.  Shown in our sleek Natural Black iron finish, but you can make it yours by choosing from the many finish and accent options available!Hand-CraftedMade in USAGuaranteed ForeverFree Shipping to the Continental United StatesChoose Your Favorite Hand-Rubbed iron Finishes and AccentsMade from Recycled Iron and Low VOC FinishesHeavy duty frameAvailable in Twin, Full, Queen, King, and California KingInstructions Included for Easy InstallationCustomizable - We Can Change Any Dimension or Detail!DimensionsHeadboard Height: 45""Footboard Height: 32""Frame Height 9""  ",https://urbanforge.com/twist-iron-bed/?sku=987-138,https://cdn11.bigcommerce.com/s-p6f4il8ut9/products/14599/images/23432/twist-bed-branded__09088.1599682174.1280.1280.jpg?c=2,in stock,1798.00 USD,,,,Furniture > Beds & Accessories,Furniture > Beds > California King,Urban Forge,,987-138,new,,,,,,Queen,14599,,,,,,,,,235,,,,No,,USD
16251,Twist Iron Bed,"Our Twist Iron Bed has a sophisticated simplicity that makes a remarkably bold statement. Modern geometric shapes in a bed inspired by iron beds of the past. The signature twist featured in the headboard and footboard and the contrasting iron treatment set this bed apart. Custom made by our artisan blacksmiths in any size, from twin to California King to be just right for your space. The elegant lines, subtle details, and twisted iron make this hand-forged iron bed a unique treasure.  Shown in our sleek Natural Black iron finish, but you can make it yours by choosing from the many finish and accent options available!Hand-CraftedMade in USAGuaranteed ForeverFree Shipping to the Continental United StatesChoose Your Favorite Hand-Rubbed iron Finishes and AccentsMade from Recycled Iron and Low VOC FinishesHeavy duty frameAvailable in Twin, Full, Queen, King, and California KingInstructions Included for Easy InstallationCustomizable - We Can Change Any Dimension or Detail!DimensionsHeadboard Height: 45""Footboard Height: 32""Frame Height 9""  ",https://urbanforge.com/twist-iron-bed/?sku=987-139,https://cdn11.bigcommerce.com/s-p6f4il8ut9/products/14599/images/23432/twist-bed-branded__09088.1599682174.1280.1280.jpg?c=2,in stock,1977.80 USD,,,,Furniture > Beds & Accessories,Furniture > Beds > California King,Urban Forge,,987-139,new,,,,,,King,14599,,,,,,,,,235,,,,No,,USD
16252,Twist Iron Bed,"Our Twist Iron Bed has a sophisticated simplicity that makes a remarkably bold statement. Modern geometric shapes in a bed inspired by iron beds of the past. The signature twist featured in the headboard and footboard and the contrasting iron treatment set this bed apart. Custom made by our artisan blacksmiths in any size, from twin to California King to be just right for your space. The elegant lines, subtle details, and twisted iron make this hand-forged iron bed a unique treasure.  Shown in our sleek Natural Black iron finish, but you can make it yours by choosing from the many finish and accent options available!Hand-CraftedMade in USAGuaranteed ForeverFree Shipping to the Continental United StatesChoose Your Favorite Hand-Rubbed iron Finishes and AccentsMade from Recycled Iron and Low VOC FinishesHeavy duty frameAvailable in Twin, Full, Queen, King, and California KingInstructions Included for Easy InstallationCustomizable - We Can Change Any Dimension or Detail!DimensionsHeadboard Height: 45""Footboard Height: 32""Frame Height 9""  ",https://urbanforge.com/twist-iron-bed/?sku=987-140,https://cdn11.bigcommerce.com/s-p6f4il8ut9/products/14599/images/23432/twist-bed-branded__09088.1599682174.1280.1280.jpg?c=2,in stock,2157.60 USD,,,,Furniture > Beds & Accessories,Furniture > Beds > California King,Urban Forge,,987-140,new,,,,,,California King,14599,,,,,,,,,235,,,,No,,USD
16265,Evergreen Wrought Iron Bed,"Urban Forge's signature Evergreen Collection is a stunning example of nature's detail expressed through exquisite craftsmanship. Enjoy the wonder of delicate Evergreen needles, the rough texture of bark, and the quiet rhythm of Evergreen cones; all rendered in solid, wrought iron. Each piece is individual to the blacksmith who created it. As in nature, no two branches are exactly alike.Our Evergreen bed brings the mystery of a night outdoors indoors with a wrought-iron Evergreen grotto. Make it your very own sanctuary of slumber. Pictured above in natural bark, the Evergreen bed is available in any of the finishes listed above. Highlight details with copper or gold finishes to catch the moonlight.It may be ordered as a complete set (including headboard, foot board and heavy duty frame), or as a headboard and frame only.Hand-CraftedMade in USAGuaranteed ForeverFree Shipping to the Continental United StatesChoose Your Favorite Hand-Rubbed iron Finishes and AccentsMade from Recycled Iron and Low VOC FinishesHeavy duty frameAvailable in Twin, Full, Queen, King, and California KingInstructions Included for Easy InstallationCustomizable - We Can Change Any Dimension or Detail!DimensionsHeadboard Height: 60""Footboard Height: 42""Frame Height: 9""",https://urbanforge.com/evergreen-wrought-iron-bed/?sku=904-091Base,https://cdn11.bigcommerce.com/s-p6f4il8ut9/products/14035/images/23443/evergreen-bed-main_copy__43899.1599684003.1280.1280.jpg?c=2,in stock,3479.00 USD,,,,Furniture > Beds & Accessories,Furniture > Beds > California King,Urban Forge,,904-091Base,new,,,,,,Queen,14035,,,,,,,,,200,,,,No,,USD
16360,Meridian Hand-Forged Iron Bed,"You can almost hear the impact of the hammer on orange hot steel as the bed is being made; one at a timeno two pieces ever the same. The trademark X pattern in each Meridian bed is both structure and design. Shown above in ""Natural Iron"" with ""Boxcar Cherry"" wood inlay, but available in other finishes as well. Meridian is elegant with sophisticated rustic undertones. It combines simple lines with the raw essence of iron. Our artisans put every hammer blow to the iron on full display, incorporating the random textures into the overall look of each piece. There are many finish options available. Any of the hand rubbed finishes will be layered to accentuate the natural textures in these pieces. Perhaps the most stunning treatment of the iron is to allow the steel to simply be itself with a natural iron special finish.Hand-CraftedMade in USAGuaranteed ForeverFree Shipping to the Continental United StatesChoose Your Favorite Hand-Rubbed iron Finishes and AccentsMade from Recycled Iron and Low VOC FinishesHeavy duty frameAvailable in Twin, Full, Queen, King, and California KingInstructions Included for Easy InstallationCustomizable - We Can Change Any Dimension or Detail!DimensionsHeadboard Height:  72""Footboard Height:  30""Frame Height 9""",https://urbanforge.com/meridian-hand-forged-iron-bed/?sku=980-UF-399Base,https://cdn11.bigcommerce.com/s-p6f4il8ut9/products/14537/images/23435/meridian-bed-main-branded__16425.1599682550.1280.1280.jpg?c=2,in stock,1678.00 USD,,,,Furniture > Beds & Accessories,Furniture > Beds > California King,Urban Forge,,980-UF-399Base,new,,,,,,,,,,,,,,,,235,,,,No,,USD
