id,title,description,link,image_link,additional_image_link,availability,price,price_x,sale_price,sale_price_effective_date,google_product_category,product_type,brand,mpn,condition,age_group,color,gender,material,pattern,size,item_group_id,promotion_id,custom_label_0,custom_label_1,custom_label_2,custom_label_3,custom_label_4,shipping,shipping_label,shipping_weight,shippg_length,shippg_width,shippg_height,is_bundle,multipack,minimum_price
16391,Vintage Crank Adjustable Dining Table,"This unique table is rich with history in both function and form. The movable cranks and gears allow for adjustment and motion that adds a great deal of interest and character to any environment. If you were able to time-travel back a century and explore a machine shop or industrial manufacturing facility, you would recognize these exact bases and mechanisms. Youd find them integrated into great presses, lathes, and machines of the past. Were excited to extend the great history of the surviving tools and molds of that era to create these bold cast iron pieces for your space.Everywhere you look on this dining table is another new detail waiting to be discovered. The handmade, thick solid wood top is beautifully distressed, with a very smooth finish - ready for everyday use in your home. Seats 8 comfortably and looks great in a wide variety of spaces, rooms, and functions.  Imagine this as an executive desk, an entryway station, a dining table, or a serving table - certainly a bold statement and conversation piece.Select a hand-rubbed iron finish to highlight the details in the base and to compliment your space and dcor. Base Dimensions: 46""L x 21""W x 22""H (extends to 33 1/2""H)Top Dimensions: 4' x 6'",https://urbanforge.com/vintage-crank-adjustable-dining-table/?sku=987-121Base,https://cdn11.bigcommerce.com/s-p6f4il8ut9/products/14582/images/23079/987-121_main__20808.1605911807.1280.1280.jpg?c=2,,in stock,3750.00 USD,3750,,,Furniture > Tables,Furniture > Tables > Desk and Writing Tables,Urban Forge,987-121Base,new,,,,,,,,,,,,,,,,1,,,,No,,USD
16392,Momentum Crank Adjustable Drafting Table,"This unique table is rich with history in both function and form. The movable cranks and gears allow for adjustment and motion that adds a great deal of interest and character to any environment. If you were able to time-travel back a century and explore a machine shop or industrial manufacturing facility, you would recognize these exact bases and mechanisms. Youd find them integrated into great presses, lathes, and machines of the past. Were excited to extend the great history of the surviving tools and molds of that era to create these bold cast iron pieces for your space.Everywhere you look on this dining table is another new detail waiting to be discovered. The handmade, thick solid wood top is beautifully distressed, with a very smooth finish - ready for everyday use in your home. Seats 8 comfortably and looks great in a wide variety of spaces, rooms, and functions.  Imagine this as an executive desk, an entryway station, a dining table, or a serving table - certainly a bold statement and conversation piece.Select a hand-rubbed iron finish to highlight the details in the base and to compliment your space and dcor. Base Dimensions: 54""L x 21 1/2""W x 25 1/2""H (extends to 34 1/2""H)Top Dimensions: 4' x 6'",https://urbanforge.com/momentum-crank-adjustable-drafting-table/?sku=987-135Base,https://cdn11.bigcommerce.com/s-p6f4il8ut9/products/14583/images/23077/987-135_main__20832.1576870680.1280.1280.jpg?c=2,,in stock,2900.00 USD,2900,,,Furniture > Tables,Furniture > Tables > Desk and Writing Tables,Urban Forge,987-135Base,new,,,,,,,,,,,,,,,,1,,,,No,,USD
16394,Station Crank Adjustable Dining Table,"This unique table is rich with history in both function and form. The movable cranks and gears allow for adjustment and motion that adds a great deal of interest and character to any environment. If you were able to time-travel back a century and explore a machine shop or industrial manufacturing facility, you would recognize these exact bases and mechanisms. Youd find them integrated into great presses, lathes, and machines of the past. Were excited to extend the great history of the surviving tools and molds of that era to create these bold cast iron pieces for your space.Everywhere you look on this dining table is another new detail waiting to be discovered. The handmade, thick solid wood top is beautifully distressed, with a very smooth finish - ready for everyday use in your home. Seats 8 comfortably and looks great in a wide variety of spaces, rooms, and functions.  Imagine this as an executive desk, an entryway station, a dining table, or a serving table - certainly a bold statement and conversation piece.Select a hand-rubbed iron finish to highlight the details in the base and to compliment your space and dcor. Base Dimensions: 62""L x 27""W x 29""HTop Dimensions: 4' x 6'",https://urbanforge.com/station-crank-adjustable-dining-table/?sku=987-124Base,https://cdn11.bigcommerce.com/s-p6f4il8ut9/products/14585/images/23070/987-124_main__55629.1576870368.1280.1280.jpg?c=2,,in stock,4550.00 USD,4550,,,Furniture > Tables,Furniture > Tables > Desk and Writing Tables,Urban Forge,987-124Base,new,,,,,,,,,,,,,,,,1,,,,No,,USD
16204,Magnolia Folding Guest Table with Topper Option,"This is the most elegant banquet or guest folding table you will find. It easily folds up for storage, without compromising design or structure. The classic Urban Forge Magnolia styling makes this table very comfortable in almost any environment from elegant to traditional, rustic or very casual. The textured iron corners add to the design and provide the wood top with protection at the corners. It comes standard in natural black but is shown here with hand rubbed bronze and gold accents...and a cherry finished top...but is available with other top and finish options.Alsoavailable is a matching two-shelf, 48"" removable table topper that is wonderful for setting up a food or drink service for your guests.Take a look at the video (below) to see how simple this inWaldrontive table is to fold up and store. Dimensions6 Foot Table Dimensions:  30""W x 72""L x 29""H8 Foot Table Dimensions:  30""W x 96""L x 29""H",https://urbanforge.com/hospitality/waterbury-folding-guest-table-with-topper-option/?sku=952-015Base,https://cdn11.bigcommerce.com/s-p6f4il8ut9/products/13841/images/20711/Waterbury_Folding_Table__74838__76490.1531087163.1280.1280.jpg?c=2,,in stock,2601.00 USD,2601,,,Furniture > Tables > Kitchen & Dining Room Tables,Furniture > Tables > Dining and Serving Tables,Urban Forge,952-015Base,new,,,,,,,,,,,,,,,,172,,,,No,,USD
16219,Greenwood Folding Guest Table,"The concept for an upscale, storable guest table was originally created for a client who was constructing a luxury West Coast resort (go take a look at www.terranea.com). They fell in love with the versatility and beauty of this piece and they are still ordering to this day.Use it proudly...and then fold it up when the guests are gone...ready for the next event. No need to set a banquet on a particle board fold-up from Sams Club! And because it stores and is often moved from place to place, we produced hand-forged corners. Again, they are beautiful ornaments that scream quality, but they also protect the most vulnerable parts of this wonderful table. It comes in either 6 or 8 foot lengths and is 30"" wide (standard).You have your choice of wood species and finishes for the top, and several different options for finishing the iron just the way you want it to be. If you need custom options, or perhaps a different top...just give us a call. We can do it!Dimensions6' Table Iron Dimensions:  64""W x 27""D x 29""H6' Table Top Size:  72""W x 30""D8' Table Iron Dimensions:  64""W x 27""D x 29""H8' Table Top Size:  96""W x 30""D ",https://urbanforge.com/hospitality/woodland-folding-guest-table/?sku=980-087Base,https://cdn11.bigcommerce.com/s-p6f4il8ut9/products/13879/images/20747/Woodland_Folding_Table__21637__45376.1531087174.1280.1280.jpg?c=2,,in stock,2465.00 USD,2465,,,Furniture > Tables > Kitchen & Dining Room Tables,Furniture > Tables > Dining and Serving Tables,Urban Forge,980-087Base,new,,,,,,,,,,,,,,,,150,,,,No,,USD
16256,Bella Vista Dining or Occasional Table,"The design theme for our Bella Vista Series was recently developed for a very exclusion, very high end resort in the northwest. We carried these same wonderful themes through several table chair and barstool designs. Our client dell in love with the hand forged texture rivets and curved features so we decided to create several item using this look. This table is beautiful and versatile. Pictured here with a 36 inch by 60 inch top and is available in many finishes. Bella Vista looks wonderful in standard natural black, but it really shines as a special finished piece to bring out the forging detail. When gold, copper or pewter accent finishes are chosen, they are typically applied to the edges and corners for a very unique look that brings out the contrasts, textures and other design elements. The item is shown in hand rubbed pewter with pewter accents. Custom sizes as well as other custom made items with the Bella Vista look are available through our custom group. Just give us a call.   Dimensions Iron Base Dimensions:  54""W x 30""D x 29""H Table Top Size:  60""W x 36""D  What are our customers saying about this piece? ""I'm very pleased with the table base that I received. It is exactly what I was looking for. Delivery was timely and the price was fair. Nice quality... thank you very much for your nice product... I won't hesitate to recommend you to my friends and relatives."" -Teresa, Texas ""We love it. I was nervous ordering it online from a company I didn't know, but it worked out great. Thank you."" -Marcy, California ""I'm very pleased with the table base that I received. It is exactly what I was looking for. Delivery was timely and the price was fair. Nice quality... thank you very much for your nice product... I won't hesitate to recommend you to my friends and relatives."" -Teresa, Texas",https://urbanforge.com/shop-new-product/montage-dining-or-occasional-table/?sku=952-060Base,https://cdn11.bigcommerce.com/s-p6f4il8ut9/products/14009/images/20897/Montage_Dining_Table__55300__25061.1531087211.1280.1280.jpg?c=2,,in stock,1219.00 USD,1219,,,Furniture > Tables > Kitchen & Dining Room Tables,Furniture > Tables > Dining and Serving Tables,Urban Forge,952-060Base,new,,,,,,,,,,,,,,,,105,30,54,29,No,,USD
16261,Magnolia Iron Dining Table 6 foot,"This table has so much character. The craftsmanship is superb, resplendent in scrolls, ornate wraps, and gentle curves. It is shown here with a distressed Evergreen table top, but there are many options available; the design provides tremendous stability and can easily accommodate even heavier tops in custom materials. Custom sizes are also available. Please contact Customer Service for more details! Dimensions: Iron Base 53""W x 21""D x 29""H Table Top 72""W x 48""D What are our customers saying about this piece? ""It looks wonderful."" -Brian, Pennsylvania ""Dear Anna, I wante to thank you for all your efforts. Please let everyone know the table legs are beautiful! When it's finally together I will send you a photo. I'm very excited after seeing them and can't wait to get the top and set it up. Thank you and Stone County so much!"" -Denise, New York ",https://urbanforge.com/shop-product/tables/waterbury-iron-dining-table-6-foot/?sku=901-124Base,https://cdn11.bigcommerce.com/s-p6f4il8ut9/products/14027/images/20947/Waterbury_Dining_Table_2__67024__34516.1531087220.1280.1280.jpg?c=2,,in stock,1625.00 USD,1625,,,Furniture > Tables > Kitchen & Dining Room Tables,Furniture > Tables > Dining and Serving Tables,Urban Forge,901-124Base,new,,,,,,,,,,,,,,,,252,,,,No,,USD
16299,Banquet Table Utility Cart,"Banquet tables, specifically the quality folding banquet tables by the blacksmiths at SCI, were in need of an easier way to move them around...and we are proud to meet that need with the versatile banquet table cart, designed to make their transportation as simple as possible.Overall Dimensions: 32"" x 89-1/2 x 45",https://urbanforge.com/hospitality/banquet-table-utility-cart/?sku=980-094Base,https://cdn11.bigcommerce.com/s-p6f4il8ut9/products/14109/images/21173/Folding_Table_Utility_Cart_Shot_2__07031__61117.1531087260.1280.1280.jpg?c=2,,in stock,1455.00 USD,1455,,,Furniture > Tables > Kitchen & Dining Room Tables,Furniture > Tables > Dining and Serving Tables,Urban Forge,980-094Base,new,,,,,,,,,,,,,,,,,,,,No,,USD
16301,Railcar Folding Banquet Table,"There are several features on the Railcar Folding Banquet Table that make it one of the most easy to use yet inspiring to look at. In keeping with the Railcar theme, it was designed with straight lines and industrial brackets, as well as hinged wheels for easy transport. It collapses and folds for convenient storage. Check out our variety of tops and specialty finishes to make this beautiful table your personal masterpiece.Dimensions6 Foot Table: 30"" x 72"" x 30""8 Foot Table: 30"" x 96"" x 30""",https://urbanforge.com/shop-new-product/trestle-folding-banquet-table/?sku=980-091Base,https://cdn11.bigcommerce.com/s-p6f4il8ut9/products/14111/images/21182/Cardiff_Folding_Banquet_Table_Shot_5__34787__04906.1531087262.1280.1280.jpg?c=2,,in stock,2383.00 USD,2383,,,Furniture > Tables > Kitchen & Dining Room Tables,Furniture > Tables > Dining and Serving Tables,Urban Forge,980-091Base,new,,,,,,,,,,,,,,,,,,,,No,,USD
16304,Quarry Buffet Table,"The Quarry Buffet Table's strong lines and hammered textures, its softened edges and softened corners, brings to mind ancient artisans and carefully forged pieces handed down for generations. Ironworks still honors this tradition of careful craftsmanship; daily, our blacksmiths forge art furniture that can stand the test of time. This Quarry buffet table stands true, shown here with a wooden top and shelf, but available with other materials.Dimensions: 60"" x 24"" x 36""",https://urbanforge.com/shop-new-product/cardiff-buffet-table/?sku=980-106Base,https://cdn11.bigcommerce.com/s-p6f4il8ut9/products/14114/images/21197/Cardiff_Buffet_Table_Shot_1__10445__68128.1531087264.1280.1280.jpg?c=2,,in stock,1108.00 USD,1108,,,Furniture > Tables > Kitchen & Dining Room Tables,Furniture > Tables > Dining and Serving Tables,Urban Forge,980-106Base,new,,,,,,,,,,,,,,,,,,,,No,,USD
16327,Evening Shade Folding Table,"This is the most elegant banquet or guest folding table you will find. The iron folding table easily folds up for storage, without compromising design or structure. The classic Urban Forge Leaf styling makes this table very comfortable in almost any environment from elegant to traditional, rustic or very casual. The textured iron corners add to the design and provide the wood top with protection at the corners. This rustic folding table comes standard in natural black, but is available with other top and finish options.Take a look at the video (below) to see how simple this inWaldrontive table is to fold up and store. Dimensions6 Foot Table Dimensions:  30""W x 72""L x 29""H8 Foot Table Dimensions:  30""W x 96""L x 29""H",https://urbanforge.com/hospitality/leaf-folding-table/?sku=952-344Base,https://cdn11.bigcommerce.com/s-p6f4il8ut9/products/14379/images/21702/Leaf-Folding-Table-6-4__50228__65832.1531087368.1280.1280.jpg?c=2,,in stock,2601.00 USD,2601,,,Furniture > Tables > Kitchen & Dining Room Tables,Furniture > Tables > Dining and Serving Tables,Urban Forge,952-344Base,new,,,,,,,,,,,,,,,,172,72,30,29,No,,USD
16328,Waldron Folding Banquet Table,"There are several features on the Waldron Folding Banquet Table that make it one of the most easy to use yet inspiring to look at. It collapses and folds for convenient storage. Check out our variety of tops and specialty finishes to make this beautiful table your personal masterpiece.Dimensions6 Foot Table: 30"" x 72"" x 30""8 Foot Table: 30"" x 96"" x 30""",https://urbanforge.com/hospitality/nova-folding-banquet-table/?sku=908-346Base,https://cdn11.bigcommerce.com/s-p6f4il8ut9/products/14381/images/21712/Simple-Folding-Table-6-2__89523__01829.1531087369.1280.1280.jpg?c=2,,in stock,1960.00 USD,1960,,,Furniture > Tables > Kitchen & Dining Room Tables,Furniture > Tables > Dining and Serving Tables,Urban Forge,908-346Base,new,,,,,,,,,,,,,,,,,,,,No,,USD
16329,Black River Farm Dining Table,"The Black River Farmhouse table is a breathtaking transitional place to gather for the home. Whether your space calls for a compact table with just a few chairs or a table large enough to seat 12, you can be sure that the Black River hand-forged iron dining table will be a conversation appetizer. Whimsical, organic strands of wrought iron bundle together to form natural iron legs that scream hand-crafted to your guests. Everywhere you look on this farmhouse dining table set is another new detail waiting to be discovered. The artisan blacksmiths who build this iron dining room furniture also pay attention to every detail. Aside from the hand-forged iron is the table top itself, which may be comprised of several different materials. This farmhouse table includes zinc, hand fired copper, or a variety of wood options, including reclaimed box car flooring with a barn wood look. The farmhouse table is available from the catalog in both a 42W x 72L and 42W x 96L configuration, but of course it can be custom ordered in virtually any size or shape imaginable.",https://urbanforge.com/shop-new-stuff/rush-farm-dining-table/?sku=980-319Base,https://cdn11.bigcommerce.com/s-p6f4il8ut9/products/14413/images/21718/rush-farm-table-8__04008__48871.1531087378.1280.1280.jpg?c=2,,in stock,3341.00 USD,3341,,,Furniture > Tables > Kitchen & Dining Room Tables,Furniture > Tables > Dining and Serving Tables,Urban Forge,980-319Base,new,,,,,,,,,,,,,,,,1,1,1,1,No,,USD
16352,Tree of Life Dining Table,"Our Tree of Life table is a sculpture of epic detail.  You'll be amazed as you explore the bark texture, the branches, leaves and birds as they are brought to life in hand-forged iron.  Each wrought iron round table base is an artisan's interpretation so no two are exactly the same. These custom round tables are truly a work of art! The branches raise up toward the sky to cradle the 1/2"" thick tempered glass top.  Share life with those you love around this beautiful custom round table.Iron Base Dimensions: 30""H x 48""W x 35""DGlass Top Dimensions: 60""",https://urbanforge.com/shop-new/tree-of-life-dining-table/?sku=980-376Bas,https://cdn11.bigcommerce.com/s-p6f4il8ut9/products/14524/images/21922/treeoflife-main__51052.1531883436.1280.1280.jpg?c=2,,in stock,7999.00 USD,7999,,,Furniture > Tables > Kitchen & Dining Room Tables,Furniture > Tables > Dining and Serving Tables,Urban Forge,980-376Bas,new,,,,,,,,,,,,,,,,1,,,,No,,USD
16398,Driftwood Dining Table,"The Urban Forge Driftwood Collection features a very organic, hand forged sculpture - each piece is as unique and individual as the wood it's modeled after.  The smooth branch texture emulates a de-barked timber that has drifted many miles and has been polished by nature's steady hand.  Each bend and taper is the product of our blacksmith artisan's vision and experience in the forge.  Truly a work of art that all will recognize and appreciate in your space.Whether your space calls for a compact table with just a few chairs or a table large enough to seat 12, you can be sure that the Driftwood hand-forged iron dining table will be a conversation appetizer. Everywhere you look on this farmhouse dining table set is another new detail waiting to be discovered. The artisan blacksmiths who build this iron dining room furniture also pay attention to every detail. Aside from the hand-forged iron is the table top itself, which may be comprised of several different materials. This farmhouse table includes zinc, hand fired copper, or a variety of wood options, including distressed boxcar flooring with a barn wood look.The Driftwood table is available in both a 42W x 72L and 42W x 96L configuration, but of course it can be custom ordered in virtually any size or shape imaginable.",https://urbanforge.com/driftwood-dining-table/?sku=980-670Base,https://cdn11.bigcommerce.com/s-p6f4il8ut9/products/14590/images/23146/driftwood-dining-main__34651.1585849652.1280.1280.jpg?c=2,,in stock,2450.00 USD,2450,,,Furniture > Tables > Kitchen & Dining Room Tables,Furniture > Tables > Dining and Serving Tables,Urban Forge,980-670Base,new,,,,,,,,,,,,,,,,1,1,1,1,No,,USD
16006,Marshall Side Table,"Our Marshall side table is a simple design, elegantly understated. If you look closely at the detail, the vertical supports have a smaller vertical strip which adds interest and dimension as a design element. This table is shown with a Natural Black finish and a distressed Evergreen top, but there are several different top and finish options, and this table can be custom made in any size. DimensionsIron Base Dimensions:  20""W x 20""D x 24""HTable Top Size:  24""W x 24""D ",https://urbanforge.com/shop-products/iron-tables/mission-side-table/?sku=901-152Base,https://cdn11.bigcommerce.com/s-p6f4il8ut9/products/13416/images/20040/901-152-DPN_Mission_Side_Table__25587__02791.1531087002.1280.1280.jpg?c=2,,in stock,608.00 USD,608,,,Furniture > Tables > Accent Tables,Furniture > Tables > Side and End Tables,Urban Forge,901-152Base,new,,,,,,,,,,,,,,,,61,,,,No,,USD
16018,Greenwood Iron Side Table,"The Greenwood Collection design is a stylish blend of organic and contemporary. The mildly textured branches are curved and shaped in a natural vertical emphasis. This look is very versatile and transitions well into most environments.Shown above in Natural Black with a distressed Evergreen tabletop, the Greenwood handcrafted side tables are available in a variety of options. Buy iron side tables for your living room online today.  DimensionsTable Base Dimensions:  20""W x 20""D x 24""HTabel Top Size:  24""W x 24""D",https://urbanforge.com/shop-products/iron-tables/woodland-iron-side-table/?sku=903-023Base,https://cdn11.bigcommerce.com/s-p6f4il8ut9/products/13446/images/20094/903-023-DPN_Woodland_Side_Table__18747__82085.1531087014.1280.1280.jpg?c=2,,in stock,608.00 USD,608,,,Furniture > Tables > Accent Tables,Furniture > Tables > Side and End Tables,Urban Forge,903-023Base,new,,,,,,,,,,,,,,,,68,,,,No,,USD
16050,Big Spring Side Table,"This table is perfect as an accent table, an end table or a side table in the living or bed room. It is extremely strong, giving it the structure to support even the heaviest tops including granite or slate.Notice how cross braces wrap around each table leg; this is done after the iron is drawn to a taper, while it is still glowing orange hot! While pictured here with a glass top, there are several options from which to choose.The design is transitional, and the right finish will allow this piece to work wonderfully in contemporary, southwest, rustic, western or elegant surroundings.DimensionsIron Base Dimensions:  20""W x 20""D x 24""H Table Top Size:  24""W x 24""D ",https://urbanforge.com/shop-products/iron-tables/ranch-side-table/?sku=900-950Base,https://cdn11.bigcommerce.com/s-p6f4il8ut9/products/13497/images/20176/900_950_GLS_Ranch_Side_Table__66185__39247.1531087032.1280.1280.jpg?c=2,,in stock,608.00 USD,608,,,Furniture > Tables > Accent Tables,Furniture > Tables > Side and End Tables,Urban Forge,900-950Base,new,,,,,,,,,,,,,,,,61,,,,No,,USD
16087,Huntington Iron Side Table,"Huntington's strong lines and hammered textures, its softened edges and softened corners, brings to mind ancient artisans and carefully forged pieces handed down for generations. Ironworks still honors this tradition of careful craftsmanship; daily, our blacksmiths forge art furniture that can stand the test of time.The Huntington side table integrates strong, simple lines and curves with a heavy iron band supporting either thick, beveled glass, or a finely-crafted chamfered walnut top. This eye-catching design is highly transitional, fitting nicely into almost any decor from elegant to rustic, old world or even contemporary. Custom sizes are available upon request.  Dimensions:  24""W x 24""D x 23"" to 25""H (varies with top selection)What are our customers saying about this piece?""Thank you for the follow up, we are pleased as always with the product."" -Mandy, designer in Colorado",https://urbanforge.com/shop-products/iron-tables/cedarvale-iron-side-table/?sku=904-442Base,https://cdn11.bigcommerce.com/s-p6f4il8ut9/products/13553/images/20293/cedar1__81385__98345.1531087057.1280.1280.jpg?c=2,,in stock,812.00 USD,812,,,Furniture > Tables > Accent Tables,Furniture > Tables > Side and End Tables,Urban Forge,904-442Base,new,,,,,,,,,,,,,,,,79,,,,No,,USD
