id,title,description,link,image_link,additional_image_link,availability,price,price_x,sale_price,sale_price_effective_date,google_product_category,product_type,brand,mpn,condition,age_group,color,gender,material,pattern,size,item_group_id,promotion_id,custom_label_0,custom_label_1,custom_label_2,custom_label_3,custom_label_4,shipping,shipping_label,shipping_weight,shippg_length,shippg_width,shippg_height,is_bundle,multipack,minimum_price
16412,Custom Size Elm Springs Fire Screen,"Twisted and textured timbers, free-flowing branches, and hand forged leaves make this stunning work of art unforgettable. Every texture and detail is fashioned in red hot iron stock at the hand of our American blacksmiths, using tools and techniques from 150 years ago. No two fire screens are ever exactly the same.For over thirty years, we have made the best fire screens money can buy. A quality fire screen has mesh durable enough to withstand heat without deforming, loose enough to see the beauty of your fireplace, and tight enough to keep sparks inside. Our artisans know how to tension the material to avoid unsightly warping, and the finish is durable while the styling is impeccable! If you can't find the right size, shape, or design, contact our custom group and we will design and make it for you.Select the dimensions your fireplace requires and our artisans will do the rest.Like everything from Urban Forge, this hand forged iron fire screen is a testament to the craftsmanship and detail our blacksmith artisans forge into every piece. Shown here in natural black, any one of these iron finishes will look great on your hearth. Try a gold or copper accent on the leaves for a nice finishing touch. Hand-CraftedMade in USAGuaranteed ForeverChoose Your Favorite Hand-Rubbed iron Finishes and AccentsMade from Recycled Iron and Low VOC FinishesCustomizable - We Can Change Any Dimension or Detail!DimensionsOur standard fire screen dimensions are 38""W x 30""H, but select the size that works best for you from the menu above and get the perfect size for your hearth.",https://urbanforge.com/custom-size-elm-springs-fire-screen/?sku=ESFSBase,https://cdn11.bigcommerce.com/s-p6f4il8ut9/products/14622/images/23479/elm-springs-firescreen-main__73227.1604438217.1280.1280.jpg?c=2,,in stock,1098.00 USD,1098,,,Home & Garden > Fireplace & Wood Stove Accessories > Fireplace Screens,Furniture > Outdoor Living > Fire Screens,Urban Forge,ESFSBase,new,,,,,,,,,,,,,,,,33,,,,No,,USD
16413,Custom Size Fair Oak Fire Screen,"The Fair Oak Fire Screen features a single center iron panel with hand-forged iron vines and leaves. Attached to the base of this wrought iron fire screen are two fixed feet for additional balance and support. This flat panel fireplace screen is shown in a natural black finish but is attractive in any of our premium finishes or added accents. We also make this product in a triple panel and able to custom produce screens with pivoting doors for more permanent installations. For over thirty years, we have made the best fire screens money can buy. A quality fire screen has mesh durable enough to withstand heat without deforming, loose enough to see the beauty of your fireplace, and tight enough to keep sparks inside. Our artisans know how to tension the material to avoid unsightly warping, and the finish is durable while the styling is impeccable! If you can't find the right size, shape, or design, contact our custom group and we will design and make it for you.Select the dimensions your fireplace requires and our artisans will do the rest.Like everything from Urban Forge, this hand forged iron fire screen is a testament to the craftsmanship and detail our blacksmith artisans forge into every piece. Shown here in natural black, any one of these iron finishes will look great on your hearth. Try a gold or copper accent on the leaves for a nice finishing touch. Hand-CraftedMade in USAGuaranteed ForeverChoose Your Favorite Hand-Rubbed iron Finishes and AccentsMade from Recycled Iron and Low VOC FinishesCustomizable - We Can Change Any Dimension or Detail!DimensionsOur standard fire screen dimensions are 38""W x 30""H, but select the size that works best for you from the menu above and get the perfect size for your hearth.",https://urbanforge.com/custom-size-fair-oak-fire-screen/?sku=900-348Cbase,https://cdn11.bigcommerce.com/s-p6f4il8ut9/products/14623/images/23484/fair-oak-firescreen-main__06186.1604440915.1280.1280.jpg?c=2,,in stock,676.00 USD,676,,,Home & Garden > Fireplace & Wood Stove Accessories > Fireplace Screens,Furniture > Outdoor Living > Fire Screens,Urban Forge,900-348Cbase,new,,,,,,,,,,,,,,,,33,,,,No,,USD
16325,The 201 Forged Swing with Reclaimed Wood Seat,"This wrought iron swing brings character and beauty to a porch or garden - or even indoors!  The incredible hand-forged iron details won't be found anywhere else.  Built one-at-a-time by an artisan blacksmith with centuries old tools and techniques. The slab wood used in the seat also has an interesting story to tell.  When beautiful round timbers are sawn into squares for lumber, the slabs are the discarded outside part of the tree...the rounded beautiful outside. Seen by many as an undesirable cull, we think they are wonderful so we rescue these beautiful slabs from the back forty or the fire!If you'd like to use the swing outdoors, choose the ""Outdoor"" option as you configure your swing.  This option upgrades the finishes used on your swing's iron and wood elements, extending the lifetime of your swing.Hand-Crafted. You wont find two identical pieces. Each artisans forge work and hammer blow makes your piece unique.Made in USAGuaranteed ForeverFree Shipping to the Continental United States on Orders Greater than $750Choose Your Favorite Hand-Rubbed Iron Finishes and AccentsMade from Recycled Iron and Low VOC FinishesCustomizable - We Can Change Any Dimension or Detail! Just ask.Dimensions 24"" Swing: Overall Dimensions (not including rope) 24W x 16D x 17H42"" Swing Overall Dimensions (not including rope) 42W x 16D x 17H ",https://urbanforge.com/the-201-forged-swing-with-reclaimed-wood-seat/?sku=980-243Base,https://cdn11.bigcommerce.com/s-p6f4il8ut9/products/14149/images/22014/201-swing-main__42059.1531963683.1280.1280.jpg?c=2,,in stock,489.00 USD,489,,,Home & Garden > Lawn & Garden > Outdoor Living > Porch Swings,Furniture > Seating > Indoor/Outdoor Swings,Urban Forge,980-243Base,new,,,,,,,,,,,,,,,,,,,,No,,USD
16076,Huntington Iron Bench,"Huntington's strong lines and hammered textures, its softened edges and softened corners, brings to mind ancient artisans and carefully forged pieces handed down for generations. Ironworks still honors this tradition of careful craftsmanship; daily, our blacksmiths forge art furniture that can stand the test of time.Our incredible oversized bench is perfect for the foot of the bed, an entry, a changing room or a more spacious bathroom. The three-button cushion is available in any of our upholstery options; additionally, you may contact us for details on custom covering. Dimensions:  48""W x 16""D x 17""H",https://urbanforge.com/huntington-iron-bench/?sku=904-441Base,https://cdn11.bigcommerce.com/s-p6f4il8ut9/products/13537/images/20272/904_441_FBK_Cedarvale_Bench__07910__20332.1531087050.1280.1280.jpg?c=2,,in stock,1163.00 USD,1163,,,Furniture > Benches,Furniture > Seating > Iron Benches & Ottomans,Urban Forge,904-441Base,new,,,,,,,,,,,,,,,,86,,,,No,,USD
16131,Iron Evergreen Bench 52 inch,"Urban Forge's signature Evergreen Collection is a stunning example of nature's detail expressed through exquisite craftsmanship. Enjoy the ephemeral quality of delicate Evergreen needles, the rough texture of bark, and the quiet rhythm of Evergreen cones; all rendered in solid, wrought iron. Each piece is individual to the blacksmith who created it. As in nature, no two branches are exactly alike.Take a look at the detail. Not only is the craftsmanship stunning, but this is also a very comfortable bench. This rustic style bench is finished with a Hand Rubbed Bronze that brings out the amazing bark textures with richness and dimensionality. While not shown here, we have also added a slight curvature to the seating slats to make it even more comfortable. This rustic style benchs feet are equipped with easy glider inserts to protect your flooring.Dimensions:  52""W x 26""D x 38""H",https://urbanforge.com/iron-evergreen-bench-52-inch/?sku=903-133Base,https://cdn11.bigcommerce.com/s-p6f4il8ut9/products/13617/images/20418/cd2_132__14653__06815.1531087084.1280.1280.jpg?c=2,,in stock,2820.00 USD,2820,,,Furniture > Benches,Furniture > Seating > Iron Benches & Ottomans,Urban Forge,903-133Base,new,,,,,,,,,,,,,,,,122,,,,No,,USD
16226,Rose Bud Iron Settee,"Elegant, casual or rustic, the Knot Collection is adaptable to any environment! The Knot Settee is a great accent piece for the living room, bedroom, entry or changing closet. The knots are literally tied and sculpted by the hands of our blacksmiths and linked together by smoothly arched iron.This settee is shown in a Natural Black finish, but especially attractive in any of our special finishes or accents. For a little contrast, consider gold or copper accent to highlight the four corner knots. Finish your inspired look with a beautifully tailored cushion seat available to any of our upholstery options.We are able to accommodate just about any of your custom needs. For instance, you might consider extending the length of this settee transforming it into a bench or ottoman. This would fit nicely at the foot of a bed or as an accent seat. Let our Custom Department help create whatever you can imagine! Dimensions:  33""W x 16""D x 23.5""H",https://urbanforge.com/rose-bud-iron-settee/?sku=904-008Base,https://cdn11.bigcommerce.com/s-p6f4il8ut9/products/13968/images/20852/904008knotsettee__63054__40721.1531087199.1280.1280.jpg?c=2,,in stock,615.00 USD,615,,,Furniture > Benches,Furniture > Seating > Iron Benches & Ottomans,Urban Forge,904-008Base,new,,,,,,,,,,,,,,,,,,,,No,,USD
16324,The 201 Forged Bench with Reclaimed Wood Seat,"The Urban Forge bench is perfect as an accent piece in the entry or mudroom, but also looks wonderful at the foot of the bed. There are lots of creative uses the this wonderful slab-wood piece. The transitional design sits comfortably in contemporary or rustic spaces, with your choice of natural or walnut finishes. Every piece is a unique masterpiece, stout hearted but simple in an elegant way. When beautiful round timbers are sawn into squares for lumber, the slabs are the discarded outside part of the tree...the rounded beautiful outside. Seen by many as an undesirable cull, we think they are wonderful so we rescue these beautiful slabs from the back forty or the fire, and make beautiful things from them! They bring character and beauty to this simple design...and are sure to do the same in the special spot of your choosing! We make other re-purposed slab designs. Check out the Urban Forge series for chairs, stools, tables, swings, and consoles21"" Bench Overall Dimensions: 21W x 12D x 18-1/2H; seat width 8""42"" Bench Overall Dimensions: 42W x 12D x 18-1/2H: seat width 8""64"" Bench Overall Dimensions: 64W x 12D x 18-1/2H; seat width 8""",https://urbanforge.com/the-201-bench/?sku=980-240Base,https://cdn11.bigcommerce.com/s-p6f4il8ut9/products/14148/images/21286/UF_Bench_21_1__57532__12014.1531087282.1280.1280.jpg?c=2,,in stock,249.00 USD,249,,,Furniture > Benches,Furniture > Seating > Iron Benches & Ottomans,Urban Forge,980-240Base,new,,,,,,,,,,,,,,US::Standard:32.25 USD,,1,1,1,1,No,,USD
15712,Caraway Iron Arm Chair,"The Caraway wrought iron arm chair is a timeless design. This elegant example of artisan blacksmith works with gently sloping lines, graceful legs, and tapered scroll arms terminates each iron arabesque in a delicate knob. The base of this wrought iron arm chair is very sturdy, and has a foot rest at a comfortable height and has easy glider inserts to protect your floors. The oversized cushion is available in any of our standard upholstery options. Our decorative iron furniture pieces may be ordered in Natural Black as shown above, or in any other of our finish options listed below.Dimensions:  24""W x 20""D x 34""H ",https://urbanforge.com/caraway-iron-arm-chair/?sku=902-862Base,https://cdn11.bigcommerce.com/s-p6f4il8ut9/products/13303/images/23897/Caraway-Bella_Chair-main__27866.1623346618.1280.1280.jpg?c=2,,in stock,744.00 USD,744,,,Furniture > Chairs,Furniture > Seating > Iron Chairs,Urban Forge,902-862Base,new,,,,,,,,,,,,,,,,44,,,,No,,USD
16049,Big Spring Iron Side Chair,"This is such a popular side chair, combining rugged and elegant aspects for universal appeal. With two cushioned seating options (premium seat shown), this chair is also as comfortable as they come. The iron is textured in the smithy style and the feet have easy glider inserts to protect your flooring. Dimensions:  17""W x 16""D x 37""H Hand-Crafted. You wont find two identical pieces. Each artisans forge work and hammer blow makes your piece unique.Made in USAGuaranteed ForeverChoose Your Favorite Hand-Rubbed Iron Finishes and AccentsMade from Recycled Iron and Low VOC FinishesCustomizable - We Can Change Any Dimension or Detail! Just ask.What are our customers saying about this piece?""The chair is beautiful!"" -Vaughan, New York",https://urbanforge.com/big-spring-iron-side-chair/?sku=900-UF-528base,https://cdn11.bigcommerce.com/s-p6f4il8ut9/products/13496/images/23871/Big_Spring-Ranch_Chair-main__04811.1623346223.1280.1280.jpg?c=2,,in stock,473.00 USD,473,,,Furniture > Chairs,Furniture > Seating > Iron Chairs,Urban Forge,900-UF-528base,new,,,,,,,,,,,,,,,,35,,,,No,,USD
16072,Huntington Iron Arm Chair,"Huntington's strong lines and hammered textures, its softened edges and softened corners, brings to mind ancient artisans and carefully forged pieces handed down for generations. Ironworks still honors this tradition of careful craftsmanship; daily, our blacksmiths forge art furniture that can stand the test of time.This iron armchair is a part of the Huntington collection. This collection is designed with distinctive features like wide textured bands and is wrapped and riveted here in the USA. The oversized cushion and padded backing makes this roomy iron armchair an inviting compliment to any space. Choose from any of our upholstry pictured below, or contact our custom department if you would like to provide your own! This custom upholstered accent chair is available with or without arms and even includes easy glider inserts on the feet to protect your flooring.Dimensions:  24""W x 24""D x 30""H",https://urbanforge.com/huntington-iron-arm-chair/?sku=904-457Base,https://cdn11.bigcommerce.com/s-p6f4il8ut9/products/13533/images/23937/Huntington-Cedarvale_Chair-main__46061.1623347082.1280.1280.jpg?c=2,,in stock,948.00 USD,948,,,Furniture > Chairs,Furniture > Seating > Iron Chairs,Urban Forge,904-457Base,new,,,,,,,,,,,,,,,,46,,,,No,,USD
16086,Huntington Iron Side Chair,"Huntington's strong lines and hammered textures, its softened edges and softened corners, brings to mind ancient artisans and carefully forged pieces handed down for generations. Ironworks still honors this tradition of careful craftsmanship; daily, our blacksmiths forge art furniture that can stand the test of time.This iron wrought chair features wide textured bands and is wrapped and riveted by our gifted American blacksmiths. The oversized cushion and padded backing makes this roomy chair an inviting compliment to any space. This custom upholstered chair is available with or without arms and includes easy glider inserts on the feet to protect your flooring.Dimensions:  18""W x 18""D x 30""H ",https://urbanforge.com/huntington-iron-side-chair/?sku=904-458Base,https://cdn11.bigcommerce.com/s-p6f4il8ut9/products/13552/images/23985/904-458-FDT_Cedarvale_Side_Chair__88597__09776.1533249692__89188.1623355657.1280.1280.jpg?c=2,,in stock,812.00 USD,812,,,Furniture > Chairs,Furniture > Seating > Iron Chairs,Urban Forge,904-458Base,new,,,,,,,,,,,,,,,,45,,,,No,,USD
16129,Evergreen Iron Side Chair,"Urban Forge's signature Evergreen Collection is a stunning example of nature's detail expressed through exquisite craftsmanship. Enjoy the ephemeral quality of delicate Evergreen needles, the rough texture of bark, and the quiet rhythm of Evergreen cones; all rendered in solid, wrought iron. Each wrought iron side chair is individual to the blacksmith who created it. As in nature, no two branches are exactly alike.This rustic side chair is a magnificent example of what can happen when a highly skilled blacksmith meets hot iron. This comfortable iron side chair is built heirloom quality and will last generations. The thick, padded cushion invites long after-dinner conversations around the table that will surely become as natural as the Evergreen branches that tie the chair together. This rustic side chair includes easy glider inserts to protect your flooring. The most popular finish chosen to highlight the bark textures in the Evergreen Collection is Hand Rubbed Bronze. For an extra touch of class choose a gold highlight for the Evergreencones! Dimensions:  18""W x 20""D x 35""H",https://urbanforge.com/evergreen-iron-side-chair/?sku=902-863Base,https://cdn11.bigcommerce.com/s-p6f4il8ut9/products/13614/images/23903/Evergreen-Pine_Chair-main__80938.1623348025.1280.1280.jpg?c=2,,in stock,874.00 USD,874,,,Furniture > Chairs,Furniture > Seating > Iron Chairs,Urban Forge,902-863Base,new,,,,Cloth- Neutral,,,13614,,,,,,,,,38,,,,No,,USD
16205,Bella Vista Side Chair,"The design theme for our Bella Vista Series was recently developed for a very exclusive, high end resort in the northwest. We carried these same wonderful themes through several table, chair and barstool designs. Our client fell in love with the hand forged textures, rivets and curved features so we decided to create several items using the look.Bella Vista looks wonderful in standard natural black, but it really shines as a special finished piece to bring out the forging detail. When gold, copper or pewter accent finishes are chosen, they are typically applied to the edges and corners for a very unique look that brings out the contrasts, textures and other design elements.The item is shown in hand rubbed brass finish. Custom sizes as well as other custom made items with the Bella Vista look are available through our custom group. Just give us a call.Dimensions:  17W x 19D x 37H Hand-Crafted. You wont find two identical pieces. Each artisans forge work and hammer blow makes your piece unique.Made in USAGuaranteed ForeverFree Shipping to the Continental United States on Orders Greater than $750Choose Your Favorite Hand-Rubbed Iron Finishes and AccentsMade from Recycled Iron and Low VOC FinishesCustomizable - We Can Change Any Dimension or Detail! Just ask.",https://urbanforge.com/bella-vista-side-chair/?sku=952-UF-063Base,https://cdn11.bigcommerce.com/s-p6f4il8ut9/products/13845/images/23852/Bella_Vista-Montage_Chair-main__01823.1623346048.1280.1280.jpg?c=2,,in stock,615.00 USD,615,,,Furniture > Chairs,Furniture > Seating > Iron Chairs,Urban Forge,952-UF-063Base,new,,,,,,,,,,,,,,,,36,19,17,37,No,,USD
16206,Blackwell Side Chair,This chair is priced in our Natural Black finish with a faux seat and back but available in any finish or upholstery. Dimensions:  16W x 20D x 36H,https://urbanforge.com/blackwell-side-chair/?sku=940-819Base,https://cdn11.bigcommerce.com/s-p6f4il8ut9/products/13848/images/23988/Forest_Hill_Chair__17502__65802.1531087165__49500.1623355793.1280.1280.jpg?c=2,,in stock,676.00 USD,676,,,Furniture > Chairs,Furniture > Seating > Iron Chairs,Urban Forge,940-819Base,new,,,,,,,,,,,,,,,,38,20,16,36,No,,USD
16284,Greenwood Side Chair,"Greenwood is a popular style so we decided to create a very nice side chair to round out the look. The hand forged limbs are lightly textured and curved to add a woodsy element...but not too much! These sturdy chairs are beautiful, functional and comfortable, with just the right amount of back support. Shown here in natural black with a standard pull down leather cushion, there are many finish and seating options available. And if you are seeking something unique, consider a custom bench with the Greenwood vibe! Give us a call!Dimensions: 17"" x 19"" x 36""",https://urbanforge.com/greenwood-side-chair/?sku=980-056Base,https://cdn11.bigcommerce.com/s-p6f4il8ut9/products/14084/images/23925/Greenwood-Woodland_Chair-main__06836.1623346937.1280.1280.jpg?c=2,,in stock,447.00 USD,447,,,Furniture > Chairs,Furniture > Seating > Iron Chairs,Urban Forge,980-056Base,new,,,,,,,,,,,,,,,,,,,,No,,USD
16321,The 201 Forged Side Chair with Reclaimed Wood Seat,"Urban Forge is a stylish line of Slab wood furniture pieces that we might describe as slightly minimalist. This Urban Forge chair is definitely a crossover design...comfortable in contemporary and crossover spaces with your choice of natural or walnut finishes. It sits easy and looks great. Every piece is a unique masterpiece, stout hearted but simple in an elegant way. When beautiful round timbers are sawn into squares for lumber, the slabs are the discarded outside part of the tree...the rounded beautiful outside. Seen by many as an undesirable cull, we think they are wonderful so we rescue these beautiful slabs from the back forty or the fire and make beautiful things from them! They bring character and beauty to this simple design...and are sure to do the same in the special spot of your choosing! We make other re-purposed slab designs. Check out the Urban Forge series for chairs, benches, stools, tables, swings, consolesHand-CraftedMade in USAGuaranteed ForeverChoose Your Favorite Hand-Rubbed Iron Finishes and AccentsMade from Recycled Iron and Low VOC FinishesCustomizable - We Can Change Any Dimension or Detail!Assembly requiredOverall Dimensions: 18W x 15D x 18-1/2Seat Height [30Overall Height]",https://urbanforge.com/the-201-forged-side-chair/?sku=980-235Base,https://cdn11.bigcommerce.com/s-p6f4il8ut9/products/14145/images/21267/Side_Chair_4__27421__07977.1531087279.1280.1280.jpg?c=2,,in stock,319.00 USD,319,,,Furniture > Chairs,Furniture > Seating > Iron Chairs,Urban Forge,980-235Base,new,,,,,,,,,,,,,,US::Standard:57.25 USD,,,,,,No,,USD
15098,Plant Industrial Stool,"This sleek stool has a modern industrial style that fits easily into any space. The base of this stool is a found industrial component rich in history. Looking back in factories a century ago youll find these same components integrated into great lathes, presses, and machines of the past. Were excited to extend the great history of the surviving tools and molds of that era to create these cast iron pieces for your space.The iron back comes in a matte pewter finish. 36""Overall Height; 21""H to top of stool seat; 21"" diameter",https://urbanforge.com/plant-industrial-stool/,https://cdn11.bigcommerce.com/s-p6f4il8ut9/products/14571/images/22987/987-126__41470.1576793674.1280.1280.jpg?c=2,,in stock,500.00 USD,500,,,Furniture > Chairs > Table & Bar Stools,Furniture > Seating > Iron Stools,Urban Forge,987-126,new,,,,,,,,,,,,,,,,1,,,,No,,USD
15711,Caraway Iron Stool,"The Caraway is truly an elegant example of artisan blacksmith work, with sloping gentle lines, graceful legs, and tapered scroll arms with a delicate ball at the end. The base is nicely designed, very sturdy and has a foot rest at a comfortable height plus easy glider inserts to protect your floors. The oversized cushion is available in any of our standard upholstery options. It is a swivel stool with a comfortable footrest integrated into the design. Standard barstool base heights are 25 or 30 inch. Adding the compressed seat thickness (1 to 2 inch) to the base height will determine the approximate seat height. Allow 7-10 inches of leg-room under the counter or bar. If more leg space is needed, custom heights are available.Dimensions25"" Iron Overall Dimensions:  24""H x 20""D x 42""H30"" Iron Overall Dimensions;  24""W x 20""D x 46""HWhat are our customers saying about this piece?""We love our Caraway barstools! Very well made and heavy."" -Kathryn, Texas",https://urbanforge.com/caraway-iron-bar-stool/?sku=902-860Base,https://cdn11.bigcommerce.com/s-p6f4il8ut9/products/13300/images/23984/902-860_25H__902-861_30H__Bella_Barstool_FDB__17356__93761.1531086961__91189.1623355619.1280.1280.jpg?c=2,,in stock,812.00 USD,812,,,Furniture > Chairs > Table & Bar Stools,Furniture > Seating > Iron Stools,Urban Forge,902-860Base,new,,,,,,,,,,,,,,,,37,,,,No,,USD
